Xin,20,2,the rise and fall of ecw,sesame street: elmo's world: the street we live on
Erin,24,1,the rise and fall of ecw
Sri,37,3,lord of the rings: the return of the king: extended edition: bonus material,love reinvented,justice league
Tyler,28,4,daydream obsession,7 seconds,inspector morse 31: death is now my neighbour,character
Nick,23,2,the rise and fall of ecw,sesame street: elmo's world: the street we live on
Aroshi,12,1,chump change
Vicky,15,3,the libertine,sex and the beauties,dinosaur planet
